{
  "contract": "ai-core-ui-component-registry/v1",
  "version": "1.1.0",
  "feature_registry": "registry/ui-ux-features.json",
  "runtime_css": "design-system/runtime-v2.css",
  "components": [
    {
      "feature_id": "action.destructive",
      "css_selector": ".ui-button.danger",
      "implementation_status": "BASE_COMPAT",
      "contract_source": "registry/ui-ux-features.json#action.destructive"
    },
    {
      "feature_id": "action.icon",
      "css_selector": ".ui-icon-button",
      "implementation_status": "RUNTIME_V2",
      "contract_source": "registry/ui-ux-features.json#action.icon"
    },
    {
      "feature_id": "action.link",
      "css_selector": "a.ui-link",
      "implementation_status": "RUNTIME_V2",
      "contract_source": "registry/ui-ux-features.json#action.link"
    },
    {
      "feature_id": "action.primary",
      "css_selector": ".ui-button",
      "implementation_status": "BASE_COMPAT",
      "contract_source": "registry/ui-ux-features.json#action.primary"
    },
    {
      "feature_id": "action.secondary",
      "css_selector": ".ui-button.secondary",
      "implementation_status": "BASE_COMPAT",
      "contract_source": "registry/ui-ux-features.json#action.secondary"
    },
    {
      "feature_id": "action.toggle",
      "css_selector": ".ui-button[aria-pressed]",
      "implementation_status": "RUNTIME_V2",
      "contract_source": "registry/ui-ux-features.json#action.toggle"
    },
    {
      "feature_id": "data.badge",
      "css_selector": ".ui-badge",
      "implementation_status": "RUNTIME_V2",
      "contract_source": "registry/ui-ux-features.json#data.badge"
    },
    {
      "feature_id": "data.source",
      "css_selector": ".ui-source",
      "implementation_status": "RUNTIME_V2",
      "contract_source": "registry/ui-ux-features.json#data.source"
    },
    {
      "feature_id": "feedback.alert",
      "css_selector": ".ui-alert",
      "implementation_status": "BASE_COMPAT",
      "contract_source": "registry/ui-ux-features.json#feedback.alert"
    },
    {
      "feature_id": "feedback.inline-error",
      "css_selector": ".ui-error",
      "implementation_status": "BASE_COMPAT",
      "contract_source": "registry/ui-ux-features.json#feedback.inline-error"
    },
    {
      "feature_id": "feedback.progress",
      "css_selector": ".ui-progress",
      "implementation_status": "BASE_COMPAT",
      "contract_source": "registry/ui-ux-features.json#feedback.progress"
    },
    {
      "feature_id": "feedback.skeleton",
      "css_selector": ".ui-skeleton",
      "implementation_status": "RUNTIME_V2",
      "contract_source": "registry/ui-ux-features.json#feedback.skeleton"
    },
    {
      "feature_id": "feedback.toast",
      "css_selector": ".ui-toast",
      "implementation_status": "BASE_COMPAT",
      "contract_source": "registry/ui-ux-features.json#feedback.toast"
    },
    {
      "feature_id": "form.checkbox",
      "css_selector": ".ui-choice input[type=\"checkbox\"]",
      "implementation_status": "BASE_COMPAT",
      "contract_source": "registry/ui-ux-features.json#form.checkbox"
    },
    {
      "feature_id": "form.chip",
      "css_selector": ".ui-chip",
      "implementation_status": "RUNTIME_V2",
      "contract_source": "registry/ui-ux-features.json#form.chip"
    },
    {
      "feature_id": "form.combobox",
      "css_selector": ".ui-combobox",
      "implementation_status": "RUNTIME_V2",
      "contract_source": "registry/ui-ux-features.json#form.combobox"
    },
    {
      "feature_id": "form.date",
      "css_selector": ".ui-input[data-ui-kind=\"date\"]",
      "implementation_status": "RUNTIME_V2",
      "contract_source": "registry/ui-ux-features.json#form.date"
    },
    {
      "feature_id": "form.money",
      "css_selector": ".ui-input[data-ui-kind=\"money\"]",
      "implementation_status": "RUNTIME_V2",
      "contract_source": "registry/ui-ux-features.json#form.money"
    },
    {
      "feature_id": "form.number",
      "css_selector": ".ui-input[data-ui-kind=\"number\"]",
      "implementation_status": "RUNTIME_V2",
      "contract_source": "registry/ui-ux-features.json#form.number"
    },
    {
      "feature_id": "form.phone-email",
      "css_selector": ".ui-input[data-ui-kind=\"contact\"]",
      "implementation_status": "RUNTIME_V2",
      "contract_source": "registry/ui-ux-features.json#form.phone-email"
    },
    {
      "feature_id": "form.radio",
      "css_selector": ".ui-choice input[type=\"radio\"]",
      "implementation_status": "BASE_COMPAT",
      "contract_source": "registry/ui-ux-features.json#form.radio"
    },
    {
      "feature_id": "form.search",
      "css_selector": ".ui-search",
      "implementation_status": "RUNTIME_V2",
      "contract_source": "registry/ui-ux-features.json#form.search"
    },
    {
      "feature_id": "form.select",
      "css_selector": ".ui-select",
      "implementation_status": "BASE_COMPAT",
      "contract_source": "registry/ui-ux-features.json#form.select"
    },
    {
      "feature_id": "form.switch",
      "css_selector": ".ui-switch",
      "implementation_status": "RUNTIME_V2",
      "contract_source": "registry/ui-ux-features.json#form.switch"
    },
    {
      "feature_id": "form.text",
      "css_selector": ".ui-input",
      "implementation_status": "BASE_COMPAT",
      "contract_source": "registry/ui-ux-features.json#form.text"
    },
    {
      "feature_id": "form.textarea",
      "css_selector": ".ui-textarea",
      "implementation_status": "BASE_COMPAT",
      "contract_source": "registry/ui-ux-features.json#form.textarea"
    },
    {
      "feature_id": "form.time",
      "css_selector": ".ui-input[data-ui-kind=\"time\"]",
      "implementation_status": "RUNTIME_V2",
      "contract_source": "registry/ui-ux-features.json#form.time"
    },
    {
      "feature_id": "navigation.bottom-nav",
      "css_selector": ".ui-bottom-nav",
      "implementation_status": "RUNTIME_V2",
      "contract_source": "registry/ui-ux-features.json#navigation.bottom-nav"
    },
    {
      "feature_id": "navigation.breadcrumb",
      "css_selector": ".ui-breadcrumb",
      "implementation_status": "RUNTIME_V2",
      "contract_source": "registry/ui-ux-features.json#navigation.breadcrumb"
    },
    {
      "feature_id": "navigation.pagination",
      "css_selector": ".ui-pagination",
      "implementation_status": "BASE_COMPAT",
      "contract_source": "registry/ui-ux-features.json#navigation.pagination"
    },
    {
      "feature_id": "navigation.segmented",
      "css_selector": ".ui-segmented",
      "implementation_status": "RUNTIME_V2",
      "contract_source": "registry/ui-ux-features.json#navigation.segmented"
    },
    {
      "feature_id": "navigation.tabs",
      "css_selector": ".ui-tabs",
      "implementation_status": "BASE_COMPAT",
      "contract_source": "registry/ui-ux-features.json#navigation.tabs"
    },
    {
      "feature_id": "overlay.bottom-sheet",
      "css_selector": ".ui-bottom-sheet",
      "implementation_status": "RUNTIME_V2",
      "contract_source": "registry/ui-ux-features.json#overlay.bottom-sheet"
    },
    {
      "feature_id": "overlay.dialog",
      "css_selector": ".ui-dialog",
      "implementation_status": "BASE_COMPAT",
      "contract_source": "registry/ui-ux-features.json#overlay.dialog"
    },
    {
      "feature_id": "overlay.drawer",
      "css_selector": ".ui-drawer",
      "implementation_status": "RUNTIME_V2",
      "contract_source": "registry/ui-ux-features.json#overlay.drawer"
    },
    {
      "feature_id": "overlay.tooltip",
      "css_selector": ".ui-tooltip",
      "implementation_status": "RUNTIME_V2",
      "contract_source": "registry/ui-ux-features.json#overlay.tooltip"
    }
  ]
}
